cik,GVKEY IQ,gvkey,tic,fic,conm,sector,industry_group,industry,sub_industry,sic,naics,NAICS6,NAICS2,NAICS3,Company Description,cluster,first_dim,second_dim
19446.0,GV_002942,2942,CMD,USA,CANTEL MEDICAL CORP,Health Care,Health Care Equipment & Services,Health Care Equipment & Supplies,Health Care Equipment,3845,334510,Electromedical and Electrotherapeutic Apparatus Manufacturing,Manufacturing,Computer and Electronic Product Manufacturing,Cantel Medical Corp. provides infection prevention and control products and services for the healthcare market.,9,-0.1748709428099568,0.2047862344689197
20520.0,GV_135484,135484,FTR,USA,FRONTIER COMMUNICATIONS CORP,Communication Services,Telecommunication Services,Diversified Telecommunication Services,Integrated Telecommunication Services,4813,517311,Wired Telecommunications Carriers,Information,Telecommunications,"Frontier Communications Corporation provides communications services to consumer, commercial, and wholesale customers in the United States.",9,0.05011600048446238,-0.15311006835869836
23675.0,GV_003416,3416,CNW,USA,CON-WAY INC,Industrials,Transportation,Road & Rail,Trucking,4210,492110,Couriers and Express Delivery Services,Transportation and Warehousing,Couriers and Messengers,"XPO CNW, Inc., together with its subsidiaries, provides transportation, logistics, and supply chain management services to various manufacturing, industrial, and retail customers in North America and internationally.",9,-0.08191114893127414,-0.0796745975466768
26324.0,GV_003662,3662,CW,USA,CURTISS-WRIGHT CORP,Industrials,Capital Goods,Aerospace & Defense,Aerospace & Defense,3728,332912,Fluid Power Valve and Hose Fitting Manufacturing,Manufacturing,Fabricated Metal Product Manufacturing,"Curtiss-Wright Corporation, together with its subsidiaries, designs, manufactures, and overhauls precision components, and engineered products and services primarily to the aerospace, defense, general industrial, and power generation markets worldwide.",9,-0.1512500224511385,0.26187043981807767
28823.0,GV_003946,3946,DBD,USA,DIEBOLD NIXDORF INC,Information Technology,Technology Hardware & Equipment,"Technology Hardware, Storage & Peripherals","Technology Hardware, Storage & Peripherals",3578,334118,Computer Terminal and Other Computer Peripheral Equipment Manufacturing,Manufacturing,Computer and Electronic Product Manufacturing,"Diebold Nixdorf, Incorporated provides connected commerce solutions to financial institutions and retailers in Western Europe, Eastern Europe, Asia, the Middle East, Africa, the United States, Canada, Mexico, and Latin America.",9,-0.1392285378501174,-0.1411510838775638
28917.0,GV_003964,3964,DDS,USA,DILLARDS INC  -CL A,Consumer Discretionary,Retailing,Multiline Retail,Department Stores,5311,452210,Department Stores,Retail Trade,General Merchandise Stores,"Dillard's, Inc. operates retail department stores primarily in the Southeastern, Southwestern, and Midwestern areas of the United States.",9,-0.12153295083824035,-0.022672424971679817
34408.0,GV_004560,4560,FDO,USA,FAMILY DOLLAR STORES,Consumer Discretionary,Retailing,Multiline Retail,General Merchandise Stores,5331,452990,"Catalog showrooms, general merchandise (except catalog mail-order)",Retail Trade,General Merchandise Stores,"Family Dollar Stores, Inc. operates a chain of general merchandise retail discount stores primarily for low- and middle-income consumers in the United States.",9,0.00012475426438648182,-0.12342317622381324
36029.0,GV_029101,29101,FFIN,USA,FIRST FINL BANKSHARES INC,Financials,Banks,Banks,Regional Banks,6020,522110,Commercial Banking,Finance and Insurance,Credit Intermediation and Related Activities,"First Financial Bankshares, Inc., through its subsidiaries, provides commercial banking products and services in Texas.",9,-0.15778822347893162,-0.06807294993057172
37008.0,GV_004740,4740,FUR,USA,WINTHROP REALTY TRUST,Real Estate,Real Estate,"Equity Real Estate 
Investment Trusts 
(REITs)",Diversified REITs,6798,525990,Other Financial Vehicles,Finance and Insurance,"Funds, Trusts, and Other Financial Vehicles",Winthrop Realty Liquidating Trust is out of business.,9,-0.02154238974291743,0.40173934977243037
37996.0,GV_004839,4839,F,USA,FORD MOTOR CO,Consumer Discretionary,Automobiles & Components,Automobiles,Automobile Manufacturers,3711,33611,Automobile and Light Duty Motor Vehicle Manufacturing,Manufacturing,Transportation Equipment Manufacturing,"Ford Motor Company designs, manufactures, markets, and services a range of Ford cars, trucks, sport utility vehicles, electrified vehicles, and Lincoln luxury vehicles worldwide.",9,0.023110840422097528,-0.3294995501074608
38074.0,GV_004843,4843,FRX,USA,FOREST LABORATORIES  -CL A,Health Care,"Pharmaceuticals, Biotechnology & Life Sciences",Pharmaceuticals,Pharmaceuticals,2834,325412,Pharmaceutical Preparation Manufacturing,Manufacturing,Chemical Manufacturing,"Forest Laboratories, LLC develops, manufactures, and sells branded forms of ethical drug products in the United States and Europe.",9,-0.029195306956022373,0.10018475137007295
39368.0,GV_004926,4926,FUL,USA,FULLER (H. B.) CO,Materials,Materials,Chemicals,Specialty Chemicals,2891,325520,Adhesive Manufacturing,Manufacturing,Chemical Manufacturing,"H.B. Fuller Company, together with its subsidiaries, formulates, manufactures, and markets adhesives, sealants, coatings, polymers, tapes, encapsulants, and other specialty chemical products worldwide.",9,0.17646076803051297,0.192134046995733
47111.0,GV_005597,5597,HSY,USA,HERSHEY CO,Consumer Staples,"Food, Beverage & Tobacco",Food Products,Packaged Foods & Meats,2060,3113,Sugar and Confectionery Product Manufacturing,Manufacturing,Food Manufacturing,"The Hershey Company, together with its subsidiaries, manufactures and sells confectionery products.",9,-0.3996940349097742,0.22258785174849727
48898.0,GV_005764,5764,HUBB,USA,HUBBELL INC,Industrials,Capital Goods,Electrical Equipment,Electrical Components & Equipment,3640,335931,Current-Carrying Wiring Device Manufacturing,Manufacturing,"Electrical Equipment, Appliance, and Component Manufacturing","Hubbell Incorporated, together with its subsidiaries, designs, manufactures, and sells electrical and electronic products in the United States and internationally.",9,-0.06478239097472789,-0.28441386157200016
49754.0,GV_024291,24291,DIN,USA,DINE BRANDS GLOBAL INC,Consumer Discretionary,Consumer Services,"Hotels, Restaurants & Leisure",Restaurants,6794,533110,Lessors of Nonfinancial Intangible Assets (except Copyrighted Works),Real Estate and Rental and Leasing,Lessors of Nonfinancial Intangible Assets (except Copyrighted Works),"Dine Brands Global, Inc., together with its subsidiaries, owns, franchises, operates, and rents full-service restaurants in the United States and internationally.",9,-0.06745564376572363,-0.0687108859705463
50725.0,GV_005987,5987,GFF,USA,GRIFFON CORP,Industrials,Capital Goods,Building Products,Building Products,3420,332216,Saw Blade and Handtool Manufacturing,Manufacturing,Fabricated Metal Product Manufacturing,"Griffon Corporation, through its subsidiaries, engages in the consumer and professional products, home and building products, and defense electronics businesses in the United States, Canada, Australia, Europe, and internationally.",9,-0.04869043250413654,0.09121706735584281
56047.0,GV_006461,6461,KEX,USA,KIRBY CORP,Industrials,Transportation,Marine,Marine,4400,483211,Inland Water Freight Transportation,Transportation and Warehousing,Water Transportation,Kirby Corporation operates domestic tank barges in the United States.,9,-0.11503243873310007,-0.15324359883643174
57725.0,GV_022632,22632,LCI,USA,LANNETT CO INC,Health Care,"Pharmaceuticals, Biotechnology & Life Sciences",Pharmaceuticals,Pharmaceuticals,2834,325412,Pharmaceutical Preparation Manufacturing,Manufacturing,Chemical Manufacturing,"Lannett Company, Inc. develops, manufactures, packages, markets, and distributes generic versions of brand pharmaceutical products in the United States.",9,0.04983250515696592,-0.0834101560428876
59478.0,GV_006730,6730,LLY,USA,LILLY (ELI) & CO,Health Care,"Pharmaceuticals, Biotechnology & Life Sciences",Pharmaceuticals,Pharmaceuticals,2834,325412,Pharmaceutical Preparation Manufacturing,Manufacturing,Chemical Manufacturing,"Eli Lilly and Company discovers, develops, manufactures, and markets pharmaceutical products worldwide.",9,-0.09671537377838771,0.032113135080809874
67625.0,GV_007525,7525,MNR,USA,MONMOUTH RE INVESTMENT CP,Real Estate,Real Estate,"Equity Real Estate 
Investment Trusts 
(REITs)",Industrial REITs,6798,531120,Lessors of Nonresidential Buildings (except Miniwarehouses),Real Estate and Rental and Leasing,Real Estate,"Monmouth Real Estate Investment Corporation, founded in 1968, is one of the oldest public equity REITs in the world.",9,0.09484471468253043,0.05455056949528202
68270.0,GV_007566,7566,RT,USA,RUBY TUESDAY INC,Consumer Discretionary,Consumer Services,"Hotels, Restaurants & Leisure",Restaurants,5812,722511,Full-Service Restaurants,Accommodation and Food Services,Food Services and Drinking Places,"Ruby Tuesday, Inc., together with its subsidiaries, engages in the ownership, development, operation, and franchise of casual dining restaurants under the Ruby Tuesday name in the United States and internationally.",9,-0.061096866376696576,0.11824172488050443
68709.0,GV_006900,6900,MTSC,USA,MTS SYSTEMS CORP,Information Technology,Technology Hardware & Equipment,"Electronic Equipment, Instruments & Components",Electronic Equipment & Instruments,3829,334519,Other Measuring and Controlling Device Manufacturing,Manufacturing,Computer and Electronic Product Manufacturing,"MTS Systems Corporation supplies test systems, motion simulators, and sensors in the Americas, Europe, and Asia.",9,-0.050007142147252874,0.08949787338488055
69488.0,GV_007636,7636,MYE,USA,MYERS INDUSTRIES INC,Materials,Materials,Containers & Packaging,Metal & Glass Containers,3089,326199,All Other Plastics Product Manufacturing,Manufacturing,Plastics and Rubber Products Manufacturing,"Myers Industries, Inc. manufactures and sells polymer products for industrial, agricultural, automotive, commercial, and consumer markets in the United States and internationally.",9,-0.09654454503987632,0.06802750479096556
70866.0,GV_007648,7648,NCR,USA,NCR CORP,Information Technology,Technology Hardware & Equipment,"Technology Hardware, Storage & Peripherals","Technology Hardware, Storage & Peripherals",7370,54151,Computer Systems Design and Related Services,"Professional, Scientific, and Technical Services","Professional, Scientific, and Technical Services","NCR Corporation provides software and services for the financial, retail, hospitality, telecommunications, and technology industries worldwide.",9,0.10225678180661114,-0.3914501180666456
75362.0,GV_008253,8253,PCAR,USA,PACCAR INC,Industrials,Capital Goods,Machinery,Construction Machinery & Heavy Trucks,3711,336120,Heavy Duty Truck Manufacturing,Manufacturing,Transportation Equipment Manufacturing,"PACCAR Inc designs, manufactures, and distributes light, medium, and heavy-duty commercial trucks in the United States, Europe, and internationally.",9,0.0053959596925658585,-0.3408467768544349
85535.0,GV_009273,9273,RGLD,USA,ROYAL GOLD INC,Materials,Materials,Metals & Mining,Gold,6795,523910,Miscellaneous Intermediation,Finance and Insurance,"Securities, Commodity Contracts, and Other Financial Investments and Related Activities","Royal Gold, Inc., together with its subsidiaries, acquires and manages precious metal streams, royalties, and related interests.",9,-0.09529771906397222,0.3739608167246054
88948.0,GV_008582,8582,SENEB,USA,SENECA FOODS CORP,Consumer Staples,"Food, Beverage & Tobacco",Food Products,Packaged Foods & Meats,2033,311421,Fruit and Vegetable Canning,Manufacturing,Food Manufacturing,Seneca Foods Corporation provides packaged fruits and vegetables in the United States and internationally.,9,-0.18732600383793518,0.12754757715868376
90498.0,GV_019355,19355,SFNC,USA,SIMMONS FIRST NATL CP  -CL A,Financials,Banks,Banks,Regional Banks,6020,522110,Commercial Banking,Finance and Insurance,Credit Intermediation and Related Activities,Simmons First National Corporation operates as the holding company for Simmons Bank that provides financial products and services to individuals and businesses.,9,-0.12198294858991239,0.1464661064867357
91928.0,GV_009831,9831,SJI,USA,SOUTH JERSEY INDUSTRIES INC,Utilities,Utilities,Gas Utilities,Gas Utilities,4924,221210,Natural Gas Distribution,Utilities,Utilities,"South Jersey Industries, Inc., through its subsidiaries, provides energy-related products and services.",9,-0.09924018326749576,0.14275876962474102
92380.0,GV_009882,9882,LUV,USA,SOUTHWEST AIRLINES,Industrials,Transportation,Airlines,Airlines,4512,481111,Scheduled Passenger Air Transportation,Transportation and Warehousing,Air Transportation,Southwest Airlines Co. operates a passenger airline that provides scheduled air transportation services in the United States and near-international markets.,9,0.03344488032949161,-0.22811567895733567
93556.0,GV_010016,10016,SWK,USA,STANLEY BLACK & DECKER INC,Industrials,Capital Goods,Machinery,Industrial Machinery,3540,333991,Power-Driven Handtool Manufacturing,Manufacturing,Machinery Manufacturing,"Stanley Black & Decker, Inc. engages in tools and storage, industrial, and security businesses worldwide.",9,-0.22122314525374068,-0.38156595335925203
94344.0,GV_010086,10086,STC,USA,STEWART INFORMATION SERVICES,Financials,Insurance,Insurance,Property & Casualty Insurance,6361,524127,Direct Title Insurance Carriers,Finance and Insurance,Insurance Carriers and Related Activities,"Stewart Information Services Corporation, through its subsidiaries, provides title insurance and real estate transaction services.",9,-0.10374661014189539,0.17763967502919398
95552.0,GV_010195,10195,SUP,USA,SUPERIOR INDUSTRIES INTL,Consumer Discretionary,Automobiles & Components,Auto Components,Auto Parts & Equipment,3714,336390,Other Motor Vehicle Parts Manufacturing,Manufacturing,Transportation Equipment Manufacturing,"Superior Industries International, Inc. designs, manufactures, and sells aluminum wheels to the original equipment manufacturers in North America and Europe.",9,-0.19417439926670918,-0.3274169306730308
106040.0,GV_011399,11399,WDC,USA,WESTERN DIGITAL CORP,Information Technology,Technology Hardware & Equipment,"Technology Hardware, Storage & Peripherals","Technology Hardware, Storage & Peripherals",3572,334112,Computer Storage Device Manufacturing,Manufacturing,Computer and Electronic Product Manufacturing,"Western Digital Corporation develops, manufactures, and sells data storage devices and solutions worldwide.",9,0.39534081441926316,-0.2137762389939313
106640.0,GV_011465,11465,WHR,USA,WHIRLPOOL CORP,Consumer Discretionary,Consumer Durables & Apparel,Household Durables,Household Appliances,3630,3352,Household Appliance Manufacturing,Manufacturing,"Electrical Equipment, Appliance, and Component Manufacturing",Whirlpool Corporation manufactures and markets home appliances and related products.,9,-0.06689465586092824,-0.37556641095448673
201283.0,GV_014316,14316,TLM.,CAN,TALISMAN ENERGY INC,Energy,Energy,"Oil, Gas & Consumable Fuels",Oil & Gas Exploration & Production,1311,211111,Coal gasification at mine site,"Mining, Quarrying, and Oil and Gas Extraction",Oil and Gas Extraction,"Repsol Oil & Gas Canada Inc., an upstream oil and gas company, engages in the exploration, development, production, transportation, and marketing of crude oil, natural gas, and natural gas liquids.",9,-0.3448482157730548,0.047920358838446205
230557.0,GV_017115,17115,SIGI,USA,SELECTIVE INS GROUP INC,Financials,Insurance,Insurance,Property & Casualty Insurance,6331,524126,Direct Property and Casualty Insurance Carriers,Finance and Insurance,Insurance Carriers and Related Activities,"Selective Insurance Group, Inc., together with its subsidiaries, provides insurance products and services in the United States.",9,-0.2583473079074282,-0.03511831337388268
320345.0,GV_007331,7331,MCRS,USA,MICROS SYSTEMS INC,Information Technology,Software & Services,Software,Systems Software,7373,541512,Computer Systems Design Services,"Professional, Scientific, and Technical Services","Professional, Scientific, and Technical Services","MICROS Systems, Inc. designs,manufactures,markets, and services enterprise applications solutions for the food and beverage,hotel,and retail industries worldwide.",9,-0.0458029301007796,-0.13888537128147696
350797.0,GV_004201,4201,EV,USA,EATON VANCE CORP,Financials,Diversified Financials,Capital Markets,Asset Management & Custody Banks,6282,523930,Investment Advice,Finance and Insurance,"Securities, Commodity Contracts, and Other Financial Investments and Related Activities","Eaton Vance Corp., through its subsidiaries, engages in the creation, marketing, and management of investment funds in the United States.",9,-0.1505775179602301,-0.04953761344667537
356028.0,GV_003310,3310,CA,USA,CA INC,Information Technology,Software & Services,Software,Systems Software,7372,511210,Software Publishers,Information,Publishing Industries (except Internet),"CA, Inc., doing business as CA technologies, develops, markets, delivers, and licenses software products and services in the United States and internationally.",9,0.4485690629667722,-0.17154924202247082
701818.0,GV_008644,8644,KGC,CAN,KINROSS GOLD CORP,Materials,Materials,Metals & Mining,Gold,1040,212221,Gold Ore Mining,"Mining, Quarrying, and Oil and Gas Extraction",Mining (except Oil and Gas),"Kinross Gold Corporation, together with its subsidiaries, engages in the acquisition, exploration, and development of gold properties in the United States, the Russian Federation, Brazil, Chile, Ghana, and Mauritania.",9,-0.16280723440798736,0.4581777763134633
704415.0,GV_024396,24396,TVTY,USA,TIVITY HEALTH INC,Health Care,Health Care Equipment & Services,Health Care Providers & Services,Health Care  Services,8090,621999,All Other Miscellaneous Ambulatory Health Care Services,Health Care and Social Assistance,Ambulatory Health Care Services,"Tivity Health, Inc. provides fitness, nutrition, and social connection solutions in the United States.",9,-0.013477559127454117,0.1641236819213687
707549.0,GV_006565,6565,LRCX,USA,LAM RESEARCH CORP,Information Technology,Semiconductors & Semiconductor Equipment,Semiconductors & Semiconductor Equipment,Semiconductor Equipment,3559,333242,Semiconductor Machinery Manufacturing,Manufacturing,Machinery Manufacturing,"Lam Research Corporation designs, manufactures, markets, refurbishes, and services semiconductor processing equipment used in the fabrication of integrated circuits worldwide.",9,0.6230950067565163,-0.19792473413030356
711377.0,GV_016453,16453,NEOG,USA,NEOGEN CORP,Health Care,Health Care Equipment & Services,Health Care Equipment & Supplies,Health Care Supplies,2834,325412,Pharmaceutical Preparation Manufacturing,Manufacturing,Chemical Manufacturing,"Neogen Corporation, together with its subsidiaries, develops, manufactures, and markets various products for food and animal safety worldwide.",9,0.12479137487899915,-0.014505066273939337
718789.0,GV_025980,25980,SHFL,USA,SHFL ENTERTAINMENT INC,Consumer Discretionary,Consumer Services,"Hotels, Restaurants & Leisure",Casinos & Gaming,3990,339999,All Other Miscellaneous Manufacturing,Manufacturing,Miscellaneous Manufacturing,"SHFL entertainment, Inc. manufactures and distributes gaming devices, operates inter-casino linked systems, slot machine routes, leases, licenses, and sells its products.",9,-0.0387929451886777,0.025891075098610952
724571.0,GV_012403,12403,FREDQ,USA,FREDS INC,Consumer Discretionary,Retailing,Multiline Retail,General Merchandise Stores,5331,452319,All Other General Merchandise Stores,Retail Trade,General Merchandise Stores,"Fred's, Inc., together with its subsidiaries, sells general merchandise through its retail discount stores and full service pharmacies.",9,-0.030966471766738887,-0.009794288547713364
724606.0,GV_024113,24113,PNRA,USA,PANERA BREAD CO,Consumer Discretionary,Consumer Services,"Hotels, Restaurants & Leisure",Restaurants,5812,722513,Limited-Service Restaurants,Accommodation and Food Services,Food Services and Drinking Places,"Panera Bread Company, together with its subsidiaries, owns, operates, and franchises retail bakery-cafes.",9,-0.0980060267629477,-0.06064390901175851
730263.0,GV_010549,10549,THO,USA,THOR INDUSTRIES INC,Consumer Discretionary,Automobiles & Components,Automobiles,Automobile Manufacturers,3790,336214,Travel Trailer and Camper Manufacturing,Manufacturing,Transportation Equipment Manufacturing,"Thor Industries, Inc., through its subsidiaries, designs, manufactures, and sells recreational vehicles (RVs), and related parts and accessories primarily in the United States, Canada, and Europe.",9,0.056020440273387324,-0.020061108864687753
737758.0,GV_010618,10618,TTC,USA,TORO CO,Industrials,Capital Goods,Machinery,Agricultural & Farm Machinery,3523,333111,Farm Machinery and Equipment Manufacturing,Manufacturing,Machinery Manufacturing,"The Toro Company designs, manufactures, and markets professional and residential equipment worldwide.",9,-0.11826570042352821,0.11994350804831755
738076.0,GV_010553,10553,COMS.,USA,3COM CORP,Information Technology,Technology Hardware & Equipment,Communications Equipment,Communications Equipment,3576,334119,ATMs (automatic teller machines) manufacturing,Manufacturing,Computer and Electronic Product Manufacturing,"3Com Corporation provides secure and converged networking solutions that enable customers to manage voice, video, and data in a secure network environment.",9,0.6625411121327607,0.2337701880716156
740694.0,GV_006357,6357,KDN,USA,KAYDON CORP,Industrials,Capital Goods,Machinery,Industrial Machinery,3562,332991,Ball and Roller Bearing Manufacturing,Manufacturing,Fabricated Metal Product Manufacturing,"Kaydon Corporation engages in the design, manufacture, and sale of custom engineered, performance-critical products in the United States, Germany, and internationally.",9,-0.30150179594437454,-0.2486594458673504
746515.0,GV_004494,4494,EXPD,USA,EXPEDITORS INTL WASH INC,Industrials,Transportation,Air Freight & Logistics,Air Freight & Logistics,4731,488510,Freight Transportation Arrangemen,Transportation and Warehousing,Support Activities for Transportation,"Expeditors International of Washington, Inc. provides logistics services in the Americas, North Asia, South Asia, Europe, the Middle East, Africa, and India.",9,0.009675934093054195,-0.06886845097695682
758004.0,GV_011910,11910,NOVL,USA,NOVELL INC,Information Technology,Software & Services,Software,Systems Software,7370,541519,Other Computer Related Services,"Professional, Scientific, and Technical Services","Professional, Scientific, and Technical Services","Novell, Inc. provides Net services software solutions that deliver services to secure various networks that include the Internet, intranets, extranets, wired to wireless networks, and corporate and public networks.",9,0.47488128605857083,-0.13247850622487828
761648.0,GV_013189,13189,CDR,USA,CEDAR REALTY TRUST INC,Real Estate,Real Estate,"Equity Real Estate 
Investment Trusts 
(REITs)",Retail REITs,6798,531120,Lessors of Nonresidential Buildings (except Miniwarehouses),Real Estate and Rental and Leasing,Real Estate,"Cedar Realty Trust, Inc. is a fully-integrated real estate investment trust which focuses on the ownership, operation and redevelopment of grocery-anchored shopping centers in high-density urban markets from Washington, D.C. to Boston.",9,-0.08344092654085745,0.6039462135577565
765880.0,GV_013125,13125,PEAK,USA,HEALTHPEAK PROPERTIES INC,Real Estate,Real Estate,"Equity Real Estate 
Investment Trusts 
(REITs)",Health Care REITs,6798,531120,Lessors of Nonresidential Buildings (except Miniwarehouses),Real Estate and Rental and Leasing,Real Estate,"Healthpeak Properties, Inc. is a fully integrated real estate investment trust (REIT) and S&P 500 company.",9,-0.0997834322474776,0.27829205853759037
766701.0,GV_013142,13142,CMO,USA,CAPSTEAD MORTGAGE CORP,Financials,Diversified Financials,"Mortgage Real Estate Investment 
Trusts (REITs)",Mortgage REITs,6798,525990,Other Financial Vehicles,Finance and Insurance,"Funds, Trusts, and Other Financial Vehicles",Capstead Mortgage Corporation operates as a real estate investment trust (REIT) in the United States.,9,-0.06527015352573962,0.34573779021143913
772406.0,GV_016401,16401,CRUS,USA,CIRRUS LOGIC INC,Information Technology,Semiconductors & Semiconductor Equipment,Semiconductors & Semiconductor Equipment,Semiconductors,3674,334413,Semiconductor and Related Device Manufacturing,Manufacturing,Computer and Electronic Product Manufacturing,"Cirrus Logic, Inc., a fabless semiconductor company, develops, manufactures, and markets analog and mixed-signal integrated circuits (ICs) in the United States and internationally.",9,0.494433899564726,-0.21069881853342487
772897.0,GV_005791,5791,HTCH,USA,HUTCHINSON TECHNOLOGY INC,Information Technology,Technology Hardware & Equipment,"Technology Hardware, Storage & Peripherals","Technology Hardware, Storage & Peripherals",3679,334418,Printed Circuit Assembly (Electronic Assembly) Manufacturing,Manufacturing,Computer and Electronic Product Manufacturing,"Hutchinson Technology Incorporated researches, designs, develops, manufactures, and supplies suspension assemblies for hard disk drives in Thailand, Hong Kong, the Philippines, Malaysia, the United States, and internationally.",9,0.3996164733656213,-0.06667818366692167
