cik,GVKEY IQ,gvkey,tic,fic,conm,sector,industry_group,industry,sub_industry,sic,naics,NAICS6,NAICS2,NAICS3,Company Description,cluster,first_dim,second_dim
912505.0,GV_029039,29039,ENIA,CHL,ENEL AMERICAS SA,Utilities,Utilities,Electric Utilities,Electric Utilities,4911,2211,"Electric Power Generation, Transmission and Distribution",Utilities,Utilities,"Enel Américas S.A., through its subsidiaries, operates as an electricity utility company in Argentina, Brazil, Colombia, and Peru.",6,0.02432141477492995,-0.24117493462051254
912562.0,GV_029131,29131,ROCK,USA,GIBRALTAR INDUSTRIES INC,Industrials,Capital Goods,Building Products,Building Products,3310,331221,Rolled Steel Shape Manufacturing,Manufacturing,Primary Metal Manufacturing,"Gibraltar Industries, Inc. manufactures and distributes building products for the renewable energy, conservation, residential, industrial, and infrastructure markets in North America and Asia.",6,-0.1571136132856572,-0.05986605529956596
912615.0,GV_029150,29150,URBN,USA,URBAN OUTFITTERS INC,Consumer Discretionary,Retailing,Specialty Retail,Apparel Retail,5651,448140,Family Clothing Stores,Retail Trade,Clothing and Clothing Accessories Stores,"Urban Outfitters, Inc. engages in the retail and wholesale of general consumer products.",6,-0.15389948362432926,-0.1785355839739934
912728.0,GV_029206,29206,FWRD,USA,FORWARD AIR CORP,Industrials,Transportation,Air Freight & Logistics,Air Freight & Logistics,4210,484110,"General Freight Trucking, Local",Transportation and Warehousing,Truck Transportation,"Forward Air Corporation, together with its subsidiaries, operates as an asset-light freight and logistics company in the United State and Canada.",6,0.027092607462495717,-0.1421375681995739
912767.0,GV_029156,29156,UFPI,USA,UNIVERSAL FOREST PRODS INC,Industrials,Capital Goods,Building Products,Building Products,2421,321999,All Other Miscellaneous Wood Product Manufacturing,Manufacturing,Wood Product Manufacturing,"Universal Forest Products, Inc., through its subsidiaries, designs, manufactures, and markets wood and wood-alternative products in North America, Europe, Asia, and Australia.",6,-0.10591352948690581,-0.10003685903252621
912898.0,GV_029607,29607,GRT,USA,GLIMCHER REALTY TRUST,Real Estate,Real Estate,"Equity Real Estate 
Investment Trusts 
(REITs)",Retail REITs,6798,531120,Lessors of Nonresidential Buildings (except Miniwarehouses),Real Estate and Rental and Leasing,Real Estate,"As of January 15, 2015, Glimcher Realty Trust was acquired by WP GLIMCHER Inc. Glimcher Realty Trust is a publicly owned equity real estate investment trust. It invests in the real estate markets of the United States.",6,-0.04753416704959416,0.20672080691902855
913241.0,GV_029382,29382,SHOO,USA,MADDEN STEVEN LTD,Consumer Discretionary,Consumer Durables & Apparel,"Textiles, Apparel & Luxury Goods",Footwear,3140,316210,Footwear Manufacturing,Manufacturing,Leather and Allied Product Manufacturing,"Steven Madden, Ltd. designs, sources, markets, and sells fashion-forward name brand and private label footwear for women, men, and children in the United States and internationally.",6,-0.0760255314729125,-0.36254178814301025
913353.0,GV_028485,28485,CIGI.,CAN,COLLIERS INTL GROUP INC,Real Estate,Real Estate,Real Estate Management & Development,Real Estate Services,6531,531210,Offices of Real Estate Agents and Brokers,Real Estate and Rental and Leasing,Real Estate,"Colliers International Group Inc. provides commercial real estate services to corporate and institutional clients in the Americas, Europe, the Middle East, Africa, and Asia Pacific.",6,-0.20879041570127493,0.09776323313366343
914024.0,GV_029353,29353,SHAW,USA,SHAW GROUP INC,Industrials,Capital Goods,Construction & Engineering,Construction & Engineering,8711,541330,Engineering Services,"Professional, Scientific, and Technical Services","Professional, Scientific, and Technical Services","CB&I Group Inc. provides design, engineering, construction, fabrication, maintenance, and environmental services.",6,-0.2659195207988821,-0.14443425212428163
915389.0,GV_029392,29392,EMN,USA,EASTMAN CHEMICAL CO,Materials,Materials,Chemicals,Diversified Chemicals,2821,325211,Plastics Material and Resin Manufacturing,Manufacturing,Chemical Manufacturing,Eastman Chemical Company operates as an advanced materials and specialty additives company worldwide.,6,-0.30175105743596936,-0.2824954420836515
916085.0,GV_029710,29710,HNT,USA,HEALTH NET INC,Health Care,Health Care Equipment & Services,Health Care Providers & Services,Managed Health Care,6324,524114,Direct Health and Medical Insurance Carriers,Finance and Insurance,Insurance Carriers and Related Activities,"Health Net, Inc. provides managed health care services through health and government-sponsored managed care plans in the United States.",6,-0.35289881759981706,0.027021679286476093
916863.0,GV_011555,11555,TEG,USA,INTEGRYS HOLDING INC,Utilities,Utilities,Multi-Utilities,Multi-Utilities,4931,2211,"Electric Power Generation, Transmission and Distribution",Utilities,Utilities,"Integrys Holding, Inc. operates as an energy holding company in the United States.",6,-0.5599994401397612,0.09947913804745774
918581.0,GV_029900,29900,CBRI,USA,CMTSU LIQUIDATION INC,Information Technology,Software & Services,IT Services,IT Consulting & Other Services,7370,541519,Other Computer Related Services,"Professional, Scientific, and Technical Services","Professional, Scientific, and Technical Services","CMTSU Liquidation, Inc. operates as an information technology (IT) service company worldwide.",6,0.3308011163357308,-0.042821414399550915
919628.0,GV_006346,6346,CKR,USA,CKE RESTAURANTS INC,Consumer Discretionary,Consumer Services,"Hotels, Restaurants & Leisure",Restaurants,5812,722513,Limited-Service Restaurants,Accommodation and Food Services,Food Services and Drinking Places,"CKE Restaurants Holdings, Inc., through its subsidiaries, owns, operates, and franchises quick-service restaurants under the Carl’s Jr.",6,0.025530113953440327,-0.03218675190441257
920371.0,GV_030260,30260,SSD,USA,SIMPSON MANUFACTURING INC,Industrials,Capital Goods,Building Products,Building Products,3420,332510,Hardware Manufacturing,Manufacturing,Fabricated Metal Product Manufacturing,"Simpson Manufacturing Co., Inc., through its subsidiaries, designs, engineers, manufactures, and sells wood and concrete building construction products.",6,-0.015940916683466835,0.1584197262983814
920527.0,GV_030161,30161,PSSI,USA,PSS WORLD MEDICAL INC,Health Care,Health Care Equipment & Services,Health Care Providers & Services,Health Care Distributors,5047,423450,"Medical, Dental, and Hospital Equipment and Supplies Merchant Wholesalers",Wholesale Trade,"Merchant Wholesalers, Durable Goods",Mckesson Medical-Surgical Top Holdings Inc. operates as a medical distributor.,6,-0.14356250713547034,0.07477336836542538
921082.0,GV_030298,30298,HIW,USA,HIGHWOODS PROPERTIES INC,Real Estate,Real Estate,"Equity Real Estate 
Investment Trusts 
(REITs)",Office REITs,6798,531120,Lessors of Nonresidential Buildings (except Miniwarehouses),Real Estate and Rental and Leasing,Real Estate,"Highwoods Properties, Inc., headquartered in Raleigh, is a publicly-traded (NYSE:HIW) real estate investment trust (“REIT”) and a member of the S&P MidCap 400 Index.",6,-0.28596329835976464,0.190135176048763
921503.0,GV_030219,30219,BTH,USA,BLYTH INC,Consumer Discretionary,Consumer Durables & Apparel,Household Durables,Housewares & Specialties,3990,339999,All Other Miscellaneous Manufacturing,Manufacturing,Miscellaneous Manufacturing,"Blyth, Inc., together with its subsidiaries, operates as a direct to consumer marketing company in the United States, Canada, Mexico, Europe, and Australia.",6,-0.07061734504555531,-0.09832086944003643
922864.0,GV_030490,30490,AIV,USA,APARTMENT INVST & MGMT CO,Real Estate,Real Estate,"Equity Real Estate 
Investment Trusts 
(REITs)",Residential REITs,6798,531110,Lessors of Residential Buildings and Dwellings,Real Estate and Rental and Leasing,Real Estate,Aimco is a real estate investment trust focused on the ownership and management of quality apartment communities located in select markets in the United States.,6,-0.21548497878441827,0.06525965368531879
926864.0,GV_030538,30538,EOCCY,CHL,ENEL GENERACION CHILE SA,Utilities,Utilities,Independent Power and Renewable Electricity Producers,Independent Power Producers & Energy Traders,4911,2211,"Electric Power Generation, Transmission and Distribution",Utilities,Utilities,"Enel Generación Chile S.A., an electric utility company, engages in the generation, transmission, and distribution of electricity in Chile.",6,0.0173388228579283,-0.18427409517270832
927628.0,GV_030990,30990,COF,USA,CAPITAL ONE FINANCIAL CORP,Financials,Diversified Financials,Consumer Finance,Consumer Finance,6141,522210,Credit Card Issuing,Finance and Insurance,Credit Intermediation and Related Activities,"Capital One Financial Corporation operates as the bank holding company for the Capital One Bank (USA), National Association; and Capital One, National Association, which provides various financial products and services in the United States, the United Kingdom, and Canada.",6,-0.20586626943184114,-0.2746528076943175
929872.0,GV_100075,100075,RENX,NLD,RELX NV,Industrials,Commercial  & Professional Services,Professional Services,Research & Consulting Services,2721,511120,Periodical Publishers,Information,Publishing Industries (except Internet),"As of September 10, 2018, RELX NV was acquired by RELX PLC.",6,0.010681747570546438,-0.030024363394368522
931015.0,GV_014311,14311,PII,USA,POLARIS INC,Consumer Discretionary,Consumer Durables & Apparel,Leisure Products,Leisure Products,3790,336999,All Other Transportation Equipment Manufacturing,Manufacturing,Transportation Equipment Manufacturing,"Polaris Inc. designs, engineers, manufactures, and markets power sports vehicles worldwide.",6,-0.012318234210691545,-0.11058486747458932
931336.0,GV_062655,62655,DFODQ,USA,DEAN FOODS CO,Consumer Staples,"Food, Beverage & Tobacco",Food Products,Packaged Foods & Meats,2020,311511,Fluid Milk Manufacturing,Manufacturing,Food Manufacturing,"Dean Foods Company, a food and beverage company, processes and distributes milk, and other dairy and dairy case products in the United States.",6,-0.29280035070954563,0.31635030645590556
935703.0,GV_031587,31587,DLTR,USA,DOLLAR TREE INC,Consumer Discretionary,Retailing,Multiline Retail,General Merchandise Stores,5331,452319,All Other General Merchandise Stores,Retail Trade,General Merchandise Stores,"Dollar Tree, Inc. operates discount variety retail stores.",6,0.13465590293362417,-0.3565415659966733
936340.0,GV_003897,3897,DTE,USA,DTE ENERGY CO,Utilities,Utilities,Multi-Utilities,Multi-Utilities,4931,2211,"Electric Power Generation, Transmission and Distribution",Utilities,Utilities,DTE Energy Company engages in the utility operations.,6,-0.4511637893449418,0.17122990769555294
936468.0,GV_006774,6774,LMT,USA,LOCKHEED MARTIN CORP,Industrials,Capital Goods,Aerospace & Defense,Aerospace & Defense,3760,336414,Guided Missile and Space Vehicle Manufacturing,Manufacturing,Transportation Equipment Manufacturing,"Lockheed Martin Corporation, a security and aerospace company, engages in the research, design, development, manufacture, integration, and sustainment of technology systems, products, and services worldwide.",6,-0.49298786639715225,0.15491227473201022
937226.0,GV_014326,14326,ONEX.,CAN,ONEX CORP,Financials,Diversified Financials,Diversified Financial Services,Multi-Sector Holdings,6799,523999,Miscellaneous Financial Investment Activities,Finance and Insurance,"Securities, Commodity Contracts, and Other Financial Investments and Related Activities",Onex Corporation is a private equity firm specializing in acquisitions and platform acquisitions.,6,0.41152654964149965,-0.06931868249895828
940944.0,GV_031846,31846,DRI,USA,DARDEN RESTAURANTS INC,Consumer Discretionary,Consumer Services,"Hotels, Restaurants & Leisure",Restaurants,5812,722511,Full-Service Restaurants,Accommodation and Food Services,Food Services and Drinking Places,"Darden Restaurants, Inc., through its subsidiaries, owns and operates full-service restaurants in the United States and Canada.",6,-0.325834318059106,-0.14406394835385658
941548.0,GV_060894,60894,CAM,USA,CAMERON INTERNATIONAL CORP,Energy,Energy,Energy Equipment & Services,Oil & Gas Equipment & Services,3533,333132,Oil and Gas Field Machinery and Equipment Manufacturing,Manufacturing,Machinery Manufacturing,"Cameron International Corporation provides flow equipment products, systems, and services worldwide.",6,0.05299313052875072,-0.23804133517755763
945764.0,GV_020653,20653,DNR,USA,DENBURY RESOURCES INC,Energy,Energy,"Oil, Gas & Consumable Fuels",Oil & Gas Exploration & Production,1311,2111,Oil and Gas Extraction,"Mining, Quarrying, and Oil and Gas Extraction",Oil and Gas Extraction,Denbury Resources Inc. operates as an independent oil and natural gas company in the United States.,6,-0.3554993035900422,0.0941085265621552
949157.0,GV_062516,62516,CENX,USA,CENTURY ALUMINUM CO,Materials,Materials,Metals & Mining,Aluminum,3350,331315,"Aluminum Sheet, Plate, and Foil Manufacturing",Manufacturing,Primary Metal Manufacturing,"Century Aluminum Company, together with its subsidiaries, produces standard-grade and value-added primary aluminum products in the United States and Iceland.",6,0.015857423812361687,-0.14635907466910586
1000300.0,GV_062344,62344,LIHR.,PNG,LIHIR GOLD LTD,Materials,Materials,Metals & Mining,Gold,1040,212221,Gold Ore Mining,"Mining, Quarrying, and Oil and Gas Extraction",Mining (except Oil and Gas),"Lihir Gold Limited produces gold in Papua New Guinea, West Africa, and Australia.",6,-0.04146316053820868,0.24477014934805771
1000753.0,GV_064302,64302,NSP,USA,INSPERITY INC,Industrials,Commercial  & Professional Services,Professional Services,Human Resource & Employment Services,7363,561320,Temporary Help Services,Administrative and Support and Waste Management and Remediation Services,Administrative and Support Services,"Insperity, Inc. provides human resources (HR) and business solutions to improve business performance for small and medium-sized businesses.",6,0.3126461475492628,0.046842668478240146
1002242.0,GV_061616,61616,E,ITA,ENI SPA,Energy,Energy,"Oil, Gas & Consumable Fuels",Integrated Oil & Gas,2911,486210,Pipeline Transportation of Natural Gas,Transportation and Warehousing,Pipeline Transportation,"Eni S.p.A. engages in the oil and gas, electricity generation and sale, and petrochemicals businesses.",6,-0.22850282988607046,-0.024156861314111287
1004440.0,GV_001995,1995,CEG,USA,CONSTELLATION ENERGY GRP INC,Utilities,Utilities,Independent Power and Renewable Electricity Producers,Independent Power Producers & Energy Traders,4931,22111,Electric Power Generation,Utilities,Utilities,"As of March 12, 2012, Constellation Energy Group, Inc. was acquired by Exelon Corporation.",6,-0.24874713355547315,0.02809944786289271
1008654.0,GV_062897,62897,TUP,USA,TUPPERWARE BRANDS CORP,Consumer Discretionary,Consumer Durables & Apparel,Household Durables,Housewares & Specialties,3089,326199,All Other Plastics Product Manufacturing,Manufacturing,Plastics and Rubber Products Manufacturing,"Tupperware Brands Corporation manufactures, markets, and sells kitchen and home, and beauty products worldwide.",6,-0.11945830178839272,0.043131135521287084
1009356.0,GV_062977,62977,SLXP,USA,SALIX PHARMACEUTICALS LTD,Health Care,"Pharmaceuticals, Biotechnology & Life Sciences",Pharmaceuticals,Pharmaceuticals,2834,325412,Pharmaceutical Preparation Manufacturing,Manufacturing,Chemical Manufacturing,"Salix Pharmaceuticals, Ltd. acquires, develops, and commercializes prescription drugs and medical devices to treat various gastrointestinal diseases in the United States.",6,-0.055771213841163264,-0.09901790870736066
1009829.0,GV_062745,62745,JAKK,USA,JAKKS PACIFIC INC,Consumer Discretionary,Consumer Durables & Apparel,Leisure Products,Leisure Products,3942,339930,"Doll, Toy, and Game Manufacturing",Manufacturing,Miscellaneous Manufacturing,"JAKKS Pacific, Inc. develops, produces, and markets consumer products worldwide.",6,0.23351076915264693,-0.3752060012994027
1011657.0,GV_062984,62984,TIE,USA,TITANIUM METALS CORP,Materials,Materials,Metals & Mining,Diversified Metals & Mining,3350,331491,"Nonferrous Metal (except Copper and Aluminum) Rolling, Drawing, and Extruding",Manufacturing,Primary Metal Manufacturing,Titanium Metals Corporation produces and sells titanium melted and mill products.,6,0.12450570114455607,-0.03641975073480397
1013237.0,GV_063172,63172,FDS,USA,FACTSET RESEARCH SYSTEMS INC,Financials,Diversified Financials,Capital Markets,Financial Exchanges & Data,7370,519130,Internet Publishing and Broadcasting and Web Search Portals,Information,Other Information Services,"FactSet Research Systems Inc. provides integrated financial information and analytical applications to the investment and corporate communities in the United States, Europe, and the Asia Pacific.",6,0.10107381279027602,-0.10417163248558883
1013880.0,GV_063417,63417,TTEC,USA,TTEC HOLDINGS INC,Information Technology,Software & Services,IT Services,Data Processing & Outsourced Services,7389,561499,All Other Business Support Services,Administrative and Support and Waste Management and Remediation Services,Administrative and Support Services,"TTEC Holdings, Inc., a customer experience technology and services company, focuses on the design, implementation, and delivery of transformative customer experience for various brands.",6,0.2863541264737287,-0.004056310829986656
1017480.0,GV_063763,63763,HIBB,USA,HIBBETT SPORTS INC,Consumer Discretionary,Retailing,Specialty Retail,Specialty Stores,5940,451110,Sporting Goods Stores,Retail Trade,"Sporting Goods, Hobby, Musical Instrument, and Book Stores","Hibbett Sports, Inc., together with its subsidiaries, engages in the retail of athletic-inspired fashion products through its stores.",6,-0.11846673554592048,-0.032470862682354044
1018724.0,GV_064768,64768,AMZN,USA,AMAZON.COM INC,Consumer Discretionary,Retailing,Internet & Direct Marketing Retail,Internet & Direct Marketing Retail,5961,454110,Electronic Shopping and Mail-Order Houses,Retail Trade,Nonstore Retailers,"Amazon.com, Inc. engages in the retail sale of consumer products and subscriptions in North America and internationally.",6,0.38391020298704825,-0.21532545327608518
1020859.0,GV_063927,63927,UNFI,USA,UNITED NATURAL FOODS INC,Consumer Staples,Food & Staples Retailing,Food & Staples Retailing,Food Distributors,5140,424490,Other Grocery and Related Products Merchant Wholesalers,Wholesale Trade,"Merchant Wholesalers, Nondurable Goods","United Natural Foods, Inc., together with its subsidiaries, distributes natural, organic, specialty, produce, and conventional grocery and non-food products in the United States and Canada.",6,-0.1771177189921463,-0.1797542384600453
1021162.0,GV_063876,63876,TGI,USA,TRIUMPH GROUP INC,Industrials,Capital Goods,Aerospace & Defense,Aerospace & Defense,3728,336413,Other Aircraft Parts and Auxiliary Equipment Manufacturing,Manufacturing,Transportation Equipment Manufacturing,"Triumph Group, Inc. designs, engineers, manufactures, repairs, overhauls, and distributes aerostructures, aircraft components, accessories, subassemblies, and systems worldwide.",6,0.024483229100805956,-0.05800670858201691
1021561.0,GV_064028,64028,NUS,USA,NU SKIN ENTERPRISES  -CL A,Consumer Staples,Household & Personal Products,Personal Products,Personal Products,2844,325620,Toilet Preparation Manufacturing,Manufacturing,Chemical Manufacturing,"Nu Skin Enterprises, Inc. develops and distributes personal care and wellness products worldwide.",6,-0.15685656291191583,0.31124938372517036
1022671.0,GV_064030,64030,STLD,USA,STEEL DYNAMICS INC,Materials,Materials,Metals & Mining,Steel,3312,331110,Iron and Steel Mills and Ferroalloy Manufacturing,Manufacturing,Primary Metal Manufacturing,"Steel Dynamics, Inc., together with its subsidiaries, operates as a steel producer and metal recycler in the United States.",6,0.09935062035615384,0.005000381308872388
1023128.0,GV_064175,64175,LAD,USA,LITHIA MOTORS INC  -CL A,Consumer Discretionary,Retailing,Specialty Retail,Automotive Retail,5500,441110,New Car Dealers,Retail Trade,Motor Vehicle and Parts Dealers,"Lithia Motors, Inc. operates as an automotive retailer in the United States.",6,0.17971910877404415,-0.11269430574287119
1025996.0,GV_064306,64306,KRC,USA,KILROY REALTY CORP,Real Estate,Real Estate,"Equity Real Estate 
Investment Trusts 
(REITs)",Office REITs,6798,531120,Lessors of Nonresidential Buildings (except Miniwarehouses),Real Estate and Rental and Leasing,Real Estate,"Kilroy Realty Corporation (KRC), a publicly traded real estate investment trust and member of the S&P MidCap 400 Index, is one of the West Coast’s premier landlords.",6,-0.12330339588622781,0.25475274938644527
1027207.0,GV_064346,64346,EPIQ,USA,EPIQ SYSTEMS INC,Information Technology,Software & Services,Software,Application Software,7372,511210,Software Publishers,Information,Publishing Industries (except Internet),"Epiq Systems, Inc. provides legal process outsourcing (LPO) services in the United States and internationally.",6,-0.038201923604058836,0.20098929812313135
1027552.0,GV_030218,30218,BSAC,CHL,BANCO SANTANDER-CHILE,Financials,Banks,Banks,Diversified Banks,6020,522110,Commercial Banking,Finance and Insurance,Credit Intermediation and Related Activities,Banco Santander-Chile provides commercial and retail banking products and services in Chile.,6,0.05350445396291875,-0.1472720917952317
1029506.0,GV_029942,29942,RAH,USA,RALCORP HOLDINGS INC,Consumer Staples,"Food, Beverage & Tobacco",Food Products,Packaged Foods & Meats,2000,311,Food Manufacturing,Manufacturing,Food Manufacturing,"TreeHouse Private Brands, Inc. engages in manufacturing, distributing, and marketing private label products to retail grocery, food away from home, and industrial and export customers.",6,-0.21707347143067643,0.06479243025712346
1031203.0,GV_065718,65718,GPI,USA,GROUP 1 AUTOMOTIVE INC,Consumer Discretionary,Retailing,Specialty Retail,Automotive Retail,5500,441110,New Car Dealers,Retail Trade,Motor Vehicle and Parts Dealers,"Group 1 Automotive, Inc., through its subsidiaries, operates in the automotive retail industry.",6,-0.10514984841706301,-0.21268278902267668
1034088.0,GV_113270,113270,ECLP,USA,ECLIPSYS CORP,Health Care,Health Care Equipment & Services,Health Care Technology,Health Care Technology,7373,541512,Computer Systems Design Services,"Professional, Scientific, and Technical Services","Professional, Scientific, and Technical Services","As of August 24, 2010, Eclipsys Corporation was acquired by Allscripts Healthcare Solutions, Inc. Eclipsys Corporation operates as a healthcare information technology company in North America, the AsiaPacific, and the Middle East. It provides integrated clinical, revenue cycle, and performance management software; and professional services that assist healthcare organizations and physicians enhance their clinical, financial, and operational processes.",6,0.10929823952082113,-0.07369766661906672
1035002.0,GV_015247,15247,VLO,USA,VALERO ENERGY CORP,Energy,Energy,"Oil, Gas & Consumable Fuels",Oil & Gas Refining & Marketing,2911,324110,Petroleum Refineries,Manufacturing,Petroleum and Coal Products Manufacturing,"Valero Energy Corporation manufactures and sells transportation fuels and petrochemical products in the United States, Canada, the United Kingdom, Ireland, and internationally.",6,0.051470813203464374,-0.01523755609994903
1035267.0,GV_136725,136725,ISRG,USA,INTUITIVE SURGICAL INC,Health Care,Health Care Equipment & Services,Health Care Equipment & Supplies,Health Care Equipment,3845,334510,Electromedical and Electrotherapeutic Apparatus Manufacturing,Manufacturing,Computer and Electronic Product Manufacturing,"Intuitive Surgical, Inc., together with its subsidiaries, designs, manufactures, and markets da Vinci surgical systems, and related instruments and accessories in the United States and internationally.",6,0.04805427094659287,0.08712330893915583
1035884.0,GV_065142,65142,CTV.1,USA,COMMSCOPE INC,Information Technology,Technology Hardware & Equipment,Communications Equipment,Communications Equipment,3357,335921,Fiber Optic Cable Manufacturing,Manufacturing,"Electrical Equipment, Appliance, and Component Manufacturing",,6,0.2977129870879519,-0.20852838502108717
1037461.0,GV_065105,65105,BJ.1,USA,BJ'S WHOLESALE CLUB INC,Consumer Staples,Food & Staples Retailing,Food & Staples Retailing,Hypermarkets & Super Centers,5399,452910,"Superstores (i.e., food and general merchandise)",Retail Trade,General Merchandise Stores,BJ's Wholesale Club Inc. operates warehouse clubs and gas stations in the eastern United States.,6,-0.05397228279632089,-0.17777971453320204
1041061.0,GV_065417,65417,YUM,USA,YUM BRANDS INC,Consumer Discretionary,Consumer Services,"Hotels, Restaurants & Leisure",Restaurants,5812,722513,Limited-Service Restaurants,Accommodation and Food Services,Food Services and Drinking Places,"YUM! Brands, Inc., together with its subsidiaries, develops, operates, and franchises quick service restaurants worldwide.",6,-0.13592915292170307,-0.08959279197887603
1041792.0,GV_064577,64577,ELP,BRA,COPEL-CIA PARANAENSE ENERGIA,Utilities,Utilities,Electric Utilities,Electric Utilities,4911,2211,"Electric Power Generation, Transmission and Distribution",Utilities,Utilities,"Companhia Paranaense de Energia - COPEL engages in the generation, transmission, distribution, and sale of electricity to industrial, residential, commercial, rural, and other customers primarily in the State of Paraná, Brazil.",6,0.10246502823461245,-0.07509795652210842
