cik,GVKEY IQ,gvkey,tic,fic,conm,sector,industry_group,industry,sub_industry,sic,naics,NAICS6,NAICS2,NAICS3,Company Description,cluster,first_dim,second_dim
1135185.0,GV_061155,61155,AAWW,USA,ATLAS AIR WORLDWIDE HLDG INC,Industrials,Transportation,Air Freight & Logistics,Air Freight & Logistics,4522,481212,Nonscheduled Chartered Freight Air Transportation,Transportation and Warehousing,Air Transportation,"Atlas Air Worldwide Holdings, Inc., through its subsidiaries, provides outsourced aircraft and aviation operating services.",2,-0.027238483598775554,0.2246292900811363
1136869.0,GV_144559,144559,ZBH,USA,ZIMMER BIOMET HOLDINGS INC,Health Care,Health Care Equipment & Services,Health Care Equipment & Supplies,Health Care Equipment,3842,339113,Surgical Appliance and Supplies Manufacturing,Manufacturing,Miscellaneous Manufacturing,"Zimmer Biomet Holdings, Inc., together with its subsidiaries, designs, manufactures, and markets musculoskeletal healthcare products and solutions in the Americas, Europe, the Middle East, Africa, and the Asia Pacific.",2,-0.03290583361950491,0.28236520918991265
1137411.0,GV_144066,144066,COL,USA,ROCKWELL COLLINS,Industrials,Capital Goods,Aerospace & Defense,Aerospace & Defense,3728,336413,Other Aircraft Parts and Auxiliary Equipment Manufacturing,Manufacturing,Transportation Equipment Manufacturing,"Collins Aerospace designs, produces and supports communication and aviation systems worldwide.",2,-0.0369090000245566,-0.06732029834034961
1137774.0,GV_143356,143356,PRU,USA,PRUDENTIAL FINANCIAL INC,Financials,Insurance,Insurance,Life & Health Insurance,6311,524113,Direct Life Insurance Carriers,Finance and Insurance,Insurance Carriers and Related Activities,"Prudential Financial, Inc., through its subsidiaries, provides insurance, investment management, and other financial products and services.",2,-0.0648043942750393,0.10029861198653081
1137789.0,GV_150937,150937,STX,IRL,SEAGATE TECHNOLOGY PLC,Information Technology,Technology Hardware & Equipment,"Technology Hardware, Storage & Peripherals","Technology Hardware, Storage & Peripherals",3572,334112,Computer Storage Device Manufacturing,Manufacturing,Computer and Electronic Product Manufacturing,"Seagate Technology plc provides data storage technology and solutions in Singapore, the United States, the Netherlands, and internationally.",2,-0.06242112891605191,0.18656072705495458
1138118.0,GV_260774,260774,CBRE,USA,CBRE GROUP INC,Real Estate,Real Estate,Real Estate Management & Development,Real Estate Services,6500,531,Real Estate,Real Estate and Rental and Leasing,Real Estate,"CBRE Group, Inc. operates as a commercial real estate services and investment company worldwide.",2,-0.07237654754250515,0.27729148891696276
1141103.0,GV_144396,144396,CCRN,USA,CROSS COUNTRY HEALTHCARE INC,Health Care,Health Care Equipment & Services,Health Care Providers & Services,Health Care  Services,7363,561320,Temporary Help Services,Administrative and Support and Waste Management and Remediation Services,Administrative and Support Services,"Cross Country Healthcare, Inc. provides healthcare staffing, recruiting, and workforce solutions in the United States.",2,0.041840189458302535,0.03333855483033371
1144215.0,GV_146017,146017,AYI,USA,ACUITY BRANDS INC,Industrials,Capital Goods,Electrical Equipment,Electrical Components & Equipment,3640,335122,"Commercial, Industrial, and Institutional Electric Lighting Fixture Manufacturing",Manufacturing,"Electrical Equipment, Appliance, and Component Manufacturing","Acuity Brands, Inc. provides lighting and building management solutions and services for commercial, institutional, industrial, infrastructure, and residential applications in North America and internationally.",2,-0.08376771615288944,0.013826114748085703
1144980.0,GV_144640,144640,ABG,USA,ASBURY AUTOMOTIVE GROUP INC,Consumer Discretionary,Retailing,Specialty Retail,Automotive Retail,5500,441110,New Car Dealers,Retail Trade,Motor Vehicle and Parts Dealers,"Asbury Automotive Group, Inc., together with its subsidiaries, operates as an automotive retailer in the United States.",2,-0.0028512362479219166,-0.0676786804011249
1156039.0,GV_145046,145046,ANTM,USA,ANTHEM INC,Health Care,Health Care Equipment & Services,Health Care Providers & Services,Managed Health Care,6324,524114,Direct Health and Medical Insurance Carriers,Finance and Insurance,Insurance Carriers and Related Activities,"Anthem, Inc., through its subsidiaries, operates as a health benefits company in the United States.",2,-0.16977634930036797,0.31391525194028747
1156375.0,GV_149070,149070,CME,USA,CME GROUP INC,Financials,Diversified Financials,Capital Markets,Financial Exchanges & Data,6200,523210,Securities and Commodity Exchanges,Finance and Insurance,"Securities, Commodity Contracts, and Other Financial Investments and Related Activities","CME Group Inc., through its subsidiaries, operates contract markets for the trading of futures and options on futures contracts worldwide.",2,-0.07108601274125301,0.18765915390945365
1156388.0,GV_145041,145041,BGFV,USA,BIG 5 SPORTING GOODS CORP,Consumer Discretionary,Retailing,Specialty Retail,Specialty Stores,5940,451110,Sporting Goods Stores,Retail Trade,"Sporting Goods, Hobby, Musical Instrument, and Book Stores",Big 5 Sporting Goods Corporation operates as a sporting goods retailer in the western United States.,2,0.06275413329997226,-0.05358816048514523
1158324.0,GV_147204,147204,CCOI,USA,COGENT COMMUNICATIONS HLDGS,Communication Services,Telecommunication Services,Diversified Telecommunication Services,Alternative Carriers,4813,517311,Wired Telecommunications Carriers,Information,Telecommunications,"Cogent Communications Holdings, Inc., through its subsidiaries, provides high-speed Internet access, private network, and data center colocation space services primarily to small and medium-sized businesses, communications service providers, and other bandwidth-intensive organizations in North America, Europe, Asia, Australia, and Brazil.",2,0.07156621485035733,0.0856902832697102
1159152.0,GV_100477,100477,JHX,IRL,JAMES HARDIE INDUSTRIES PLC,Materials,Materials,Construction Materials,Construction Materials,3270,327420,Gypsum Product Manufacturing,Manufacturing,Nonmetallic Mineral Product Manufacturing,"James Hardie Industries plc, together with its subsidiaries, manufactures and sells fiber cement siding and backer board products primarily in the United States, Canada, Australia, New Zealand, the Philippines, and Europe.",2,-0.0009923028603500883,0.041584574387745384
1159154.0,GV_147639,147639,RJETQ,USA,REPUBLIC AIRWAYS HLDGS INC,Industrials,Transportation,Airlines,Airlines,4512,481111,Scheduled Passenger Air Transportation,Transportation and Warehousing,Air Transportation,"Republic Airways Holdings Inc., through its subsidiaries, provides scheduled passenger services.",2,-0.04794579495187819,0.23570987910262606
1160110.0,GV_238616,238616,VEOEY,FRA,VEOLIA ENVIRONNEMENT,Utilities,Utilities,Multi-Utilities,Multi-Utilities,4941,221310,Water Supply and Irrigation Systems,Utilities,Utilities,"Veolia Environnement S.A. designs and provides water, waste, and energy management solutions worldwide.",2,-0.005799476476565473,-0.04196622439908673
1160858.0,GV_153028,153028,TRLG,USA,TRUE RELIGION APPAREL INC,Consumer Discretionary,Consumer Durables & Apparel,"Textiles, Apparel & Luxury Goods","Apparel, Accessories & Luxury Goods",2300,315,Apparel Manufacturing,Manufacturing,Apparel Manufacturing,"True Religion Apparel, Inc. designs, markets, sells, and distributes apparel under the True Religion Brand Jeans name worldwide.",2,-0.021793976402003087,0.1602355413330581
1161125.0,GV_241366,241366,BCH,CHL,BANCO DE CHILE,Financials,Banks,Banks,Diversified Banks,6020,522110,Commercial Banking,Finance and Insurance,Credit Intermediation and Related Activities,"Banco de Chile, together with its subsidiaries, provides banking and financial products and services to customers in Chile.",2,-0.0017133831713731743,0.05016010834321878
1165231.0,GV_158791,158791,PKT,USA,PROCERA NETWORKS INC,Information Technology,Technology Hardware & Equipment,Communications Equipment,Communications Equipment,3576,334210,Telephone Apparatus Manufacturing,Manufacturing,Computer and Electronic Product Manufacturing,Sandvine Corporation designs and sells subscriber experience assurance solutions based on deep packet inspection (DPI) technology to network operators worldwide.,2,0.006621455135773238,0.2604853947739086
1165880.0,GV_148932,148932,MRH,BMU,MONTPELIER RE HOLDINGS,Financials,Insurance,Insurance,Reinsurance,6331,524130,Reinsurance Carriers,Finance and Insurance,Insurance Carriers and Related Activities,"Montpelier Re Holdings Ltd., through its subsidiaries, provides insurance and reinsurance solutions worldwide.",2,-0.06111708401816476,0.13679146659917918
1168054.0,GV_150699,150699,XEC,USA,CIMAREX ENERGY CO,Energy,Energy,"Oil, Gas & Consumable Fuels",Oil & Gas Exploration & Production,1311,2111,Oil and Gas Extraction,"Mining, Quarrying, and Oil and Gas Extraction",Oil and Gas Extraction,"Cimarex Energy Co. operates as an independent oil and gas exploration and production company primarily in Texas, Oklahoma, and New Mexico. As of December 31, 2019, it had a total proved reserves of 619.6 million barrels of oil equivalent, consisting of 1.53 trillion cubic feet of natural gas; 169.8 million barrels (MMBbls) of oil; and 194.5 MMBbls of natural gas liquids primarily located in the Permian Basin and Mid-Continent regions.",2,-0.16000136295692735,0.31254333493449593
1168213.0,GV_147661,147661,AROPQ,USA,ARO LIQUIDATION INC,Consumer Discretionary,Retailing,Specialty Retail,Apparel Retail,5621,448120,Women's Clothing Stores,Retail Trade,Clothing and Clothing Accessories Stores,"On April 17, 2018, ARO Liquidation, Inc. went out of business as per its Chapter 11 liquidation filing under bankruptcy.",2,0.006269182777596169,0.005727348950492833
1168478.0,GV_147658,147658,HEW,USA,HEWITT ASSOCIATES INC,Information Technology,Software & Services,IT Services,Data Processing & Outsourced Services,7374,518210,"Data Processing, Hosting, and Related Services",Information,"Data Processing, Hosting, and Related Services","Aon Hewitt LLC provides human resources outsourcing, consulting, and insurance brokerage services to organizations in the United States and internationally.",2,-0.020988511980168652,0.29630484654708683
1169445.0,GV_147849,147849,CPSI,USA,COMPUTER PROGRAMS & SYSTEMS,Health Care,Health Care Equipment & Services,Health Care Technology,Health Care Technology,7373,541512,Computer Systems Design Services,"Professional, Scientific, and Technical Services","Professional, Scientific, and Technical Services","Computer Programs and Systems, Inc. provides healthcare information technology solutions and services in the United States and the Caribbean nation of St. Maarten.",2,-0.0062648533191368,0.16055511559079555
1169770.0,GV_149618,149618,BANC,USA,BANC OF CALIFORNIA INC,Financials,Banks,Banks,Regional Banks,6020,522110,Commercial Banking,Finance and Insurance,Credit Intermediation and Related Activities,"Banc of California, Inc. operates as the bank holding company for Banc of California, National Association that provides banking products and services in the United States.",2,-0.05553763802920655,0.10738648987999906
1170650.0,GV_007186,7186,MHS,USA,MEDCO HEALTH SOLUTIONS INC,Health Care,Health Care Equipment & Services,Health Care Providers & Services,Health Care  Services,5912,446110,Pharmacies and Drug Stores,Retail Trade,Health and Personal Care Stores,"Medco Health Solutions, Inc. is a healthcare company provides clinically-driven pharmacy services for private and public employers, health plans, labor unions and government agencies, and individuals.",2,-0.00937530633838831,0.2087265559961596
1171759.0,GV_148470,148470,RRGB,USA,RED ROBIN GOURMET BURGERS,Consumer Discretionary,Consumer Services,"Hotels, Restaurants & Leisure",Restaurants,5812,722511,Full-Service Restaurants,Accommodation and Food Services,Food Services and Drinking Places,"Red Robin Gourmet Burgers, Inc., together with its subsidiaries, develops, operates, and franchises full-service and casual-dining restaurants.",2,-0.0205684042146724,0.04420498202566718
1172052.0,GV_148469,148469,SAFT,USA,SAFETY INSURANCE GROUP INC,Financials,Insurance,Insurance,Property & Casualty Insurance,6331,524126,Direct Property and Casualty Insurance Carriers,Finance and Insurance,Insurance Carriers and Related Activities,"Safety Insurance Group, Inc. provides private passenger and commercial automobile insurance in Massachusetts, New Hampshire, and Maine, the United States.",2,-0.14294128810444243,0.26352025485627856
1172480.0,GV_157954,157954,SNTS,USA,SANTARUS INC,Health Care,"Pharmaceuticals, Biotechnology & Life Sciences",Pharmaceuticals,Pharmaceuticals,2834,325412,Pharmaceutical Preparation Manufacturing,Manufacturing,Chemical Manufacturing,"Santarus, Inc., a specialty biopharmaceutical company, focuses on acquiring, developing, and commercializing proprietary products that address the needs of patients treated by physician specialists.",2,0.04248129959104971,0.1494957433172953
1175580.0,GV_205692,205692,GOLD.3,JEY,RANDGOLD RESOURCES LTD,Materials,Materials,Metals & Mining,Gold,1040,212221,Gold Ore Mining,"Mining, Quarrying, and Oil and Gas Extraction",Mining (except Oil and Gas),Barrick Gold (Holdings) Limited explores for and develops gold deposits in Sub-Saharan Africa.,2,-0.15252527603076774,0.37984165071622294
1177293.0,GV_152692,152692,PMT.,CAN,PERPETUAL ENERGY INC,Energy,Energy,"Oil, Gas & Consumable Fuels",Oil & Gas Exploration & Production,1311,2111,Oil and Gas Extraction,"Mining, Quarrying, and Oil and Gas Extraction",Oil and Gas Extraction,"Perpetual Energy Inc. engages in the exploration, development, production, and marketing of oil and natural gas based energy in Canada.",2,-0.0836122876359454,0.19871631272725684
1177394.0,GV_156155,156155,SNX,USA,SYNNEX CORP,Information Technology,Technology Hardware & Equipment,"Electronic Equipment, Instruments & Components",Technology Distributors,5045,423430,Computer and Computer Peripheral Equipment and Software Merchant Wholesalers,Wholesale Trade,"Merchant Wholesalers, Durable Goods",SYNNEX Corporation provides business process services in the United States and internationally.,2,-0.028874719307250836,0.33218007847291636
1177702.0,GV_150481,150481,SAIA,USA,SAIA INC,Industrials,Transportation,Road & Rail,Trucking,4213,484122,"General Freight Trucking, Long-Distance, Less Than Truckload",Transportation and Warehousing,Truck Transportation,"Saia, Inc., through its subsidiaries, operates as a transportation company in North America.",2,-0.06226468902098925,0.1923937774156415
1178819.0,GV_152848,152848,AGI.4,CAN,ALAMOS GOLD INC -OLD,Materials,Materials,Metals & Mining,Gold,1040,212221,Gold Ore Mining,"Mining, Quarrying, and Oil and Gas Extraction",Mining (except Oil and Gas),"As of July 2, 2015, Alamos Gold, Inc., Prior to Acquisition by AuRico Gold, Inc. was acquired by AuRico Gold, Inc. Alamos Gold, Inc., a gold mining company, engages in the exploration, mine development, and mining and extraction of precious metals, primarily gold.",2,-0.04894756751823509,0.2966003424727206
1178970.0,GV_150279,150279,PFS,USA,PROVIDENT FINANCIAL SVCS INC,Financials,Banks,Thrifts & Mortgage Finance,Thrifts & Mortgage Finance,6036,522120,Savings Institutions,Finance and Insurance,Credit Intermediation and Related Activities,"Provident Financial Services, Inc. operates as the holding company for Provident Bank that provides various banking services to individuals, families, and businesses in the United States.",2,-0.03188067272357379,0.17392382544921675
1179755.0,GV_152249,152249,ENH,BMU,ENDURANCE SPECIALTY HOLDINGS,Financials,Insurance,Insurance,Reinsurance,6331,524126,Direct Property and Casualty Insurance Carriers,Finance and Insurance,Insurance Carriers and Related Activities,"Sompo International Holdings Ltd., through its subsidiaries, underwrites specialty lines of personal and commercial property and casualty insurance, and reinsurance worldwide.",2,-0.061668522287286545,0.13312488029990238
1179929.0,GV_152149,152149,MOH,USA,MOLINA HEALTHCARE INC,Health Care,Health Care Equipment & Services,Health Care Providers & Services,Managed Health Care,6324,524114,Direct Health and Medical Insurance Carriers,Finance and Insurance,Insurance Carriers and Related Activities,"Molina Healthcare, Inc. provides managed health care services to low-income families and individuals under the Medicaid and Medicare programs and through the state insurance marketplaces.",2,-0.07916571990355109,0.2148933356569474
1183186.0,GV_154056,154056,NFP,USA,NATIONAL FINANCIAL PRTNRS CP,Financials,Insurance,Insurance,Insurance Brokers,6411,524292,Third Party Administration of Insurance and Pension Funds,Finance and Insurance,Insurance Carriers and Related Activities,"NFP Corp. operates as an insurance broker, consultant, and wealth management company.",2,-0.05926146814671412,0.267853018689981
1185348.0,GV_150477,150477,PRAA,USA,PRA GROUP INC,Financials,Diversified Financials,Consumer Finance,Consumer Finance,6153,522298,All Other Nondepository Credit Intermediation,Finance and Insurance,Credit Intermediation and Related Activities,"PRA Group, Inc., a financial and business services company, engages in the purchase, collection, and management of portfolios of nonperforming loans in the Americas and Europe.",2,-0.037575686292415124,0.25167870237039114
1190723.0,GV_151933,151933,TS,LUX,TENARIS SA,Energy,Energy,Energy Equipment & Services,Oil & Gas Equipment & Services,3317,331210,Iron and Steel Pipe and Tube Manufacturing from Purchased Steel,Manufacturing,Primary Metal Manufacturing,"Tenaris S.A., through its subsidiaries, produces and sells seamless and welded steel tubular products; and provides related services for the oil and gas industry, and other industrial applications.",2,-0.12874782366195783,0.24715583901375646
1195933.0,GV_110065,110065,IPCC,USA,INFINITY PROPERTY & CAS CORP,Financials,Insurance,Insurance,Property & Casualty Insurance,6331,524126,Direct Property and Casualty Insurance Carriers,Finance and Insurance,Insurance Carriers and Related Activities,"Infinity Property and Casualty Corporation, through its subsidiaries, provides personal auto insurance products in the United States.",2,-0.01793900021038123,0.1620907625034464
1206264.0,GV_156861,156861,TPX,USA,TEMPUR SEALY INTL INC,Consumer Discretionary,Consumer Durables & Apparel,Household Durables,Home Furnishings,2510,337910,Mattress Manufacturing,Manufacturing,Furniture and Related Product Manufacturing,"Tempur Sealy International, Inc., together with its subsidiaries, develops, manufactures, markets, and distributes bedding products in the United States, Canada, and internationally.",2,-0.06179449966156116,0.27579451979002895
1220754.0,GV_154758,154758,PRSC,USA,PROVIDENCE SERVICE CORP,Health Care,Health Care Equipment & Services,Health Care Providers & Services,Health Care  Services,4100,485991,Special Needs Transportation,Transportation and Warehousing,Transit and Ground Passenger Transportation,The Providence Service Corporation provides healthcare services in the United States.,2,-0.017284017807619553,0.25780582184021095
1223389.0,GV_156614,156614,CONN,USA,CONN'S INC,Consumer Discretionary,Retailing,Specialty Retail,Computer & Electronics Retail,5731,443142,Electronics Stores,Retail Trade,Electronics and Appliance Stores,"Conn's, Inc. operates as a specialty retailer of durable consumer goods and related services in the United States.",2,-0.04046921430286022,0.21320916321504044
1224608.0,GV_012603,12603,CNO,USA,CNO FINANCIAL GROUP INC,Financials,Insurance,Insurance,Life & Health Insurance,6321,524114,Direct Health and Medical Insurance Carriers,Finance and Insurance,Insurance Carriers and Related Activities,"CNO Financial Group, Inc., through its subsidiaries, develops, markets, and administers health insurance, annuity, individual life insurance, and other insurance products for senior and middle-income markets in the United States.",2,-0.0735666467791649,0.2227573191265473
1227654.0,GV_157153,157153,CMP,USA,COMPASS MINERALS INTL INC,Materials,Materials,Metals & Mining,Diversified Metals & Mining,1400,212393,Other Chemical and Fertilizer Mineral Mining,"Mining, Quarrying, and Oil and Gas Extraction",Mining (except Oil and Gas),"Compass Minerals International, Inc., produces and sells salt, and specialty plant nutrition and chemical products primarily in the United States, Canada, Brazil, and the United Kingdom.",2,-0.09633593093189897,0.2803284228061753
1230245.0,GV_008605,8605,PIPR,USA,PIPER SANDLER COS,Financials,Diversified Financials,Capital Markets,Investment Banking & Brokerage,6211,523120,Securities Brokerage,Finance and Insurance,"Securities, Commodity Contracts, and Other Financial Investments and Related Activities","Piper Sandler Companies operates as an investment bank and asset management firm that serves corporations, private equity groups, public entities, non-profit entities, and institutional investors in the United States and internationally.",2,-0.035580557007323564,0.31488430188411737
1232582.0,GV_155754,155754,AHT,USA,ASHFORD HOSPITALITY TRUST,Real Estate,Real Estate,"Equity Real Estate 
Investment Trusts 
(REITs)",Hotel & Resort REITs,6798,531190,Lessors of Other Real Estate Property,Real Estate and Rental and Leasing,Real Estate,"Ashford Hospitality Trust is a real estate investment trust (REIT) focused on investing predominantly in upper upscale, full-service hotels.",2,-0.06866155047087394,0.29977216758580555
1254595.0,GV_155174,155174,FPO,USA,FIRST POTOMAC REALTY TRUST,Real Estate,Real Estate,"Equity Real Estate 
Investment Trusts 
(REITs)",Diversified REITs,6798,531120,Lessors of Nonresidential Buildings (except Miniwarehouses),Real Estate and Rental and Leasing,Real Estate,"As of October 1, 2017, First Potomac Realty Trust was acquired by Government Properties Income Trust. It is a self-administered, self-managed real estate investment trust that focuses on owning, operating, developing and redeveloping office and business park properties in the greater Washington, D.C. region.",2,-0.14680465716709487,0.32310905095636816
1255474.0,GV_155393,155393,WLL,USA,WHITING PETROLEUM CORP,Energy,Energy,"Oil, Gas & Consumable Fuels",Oil & Gas Exploration & Production,1311,211120,Crude Petroleum Extraction,"Mining, Quarrying, and Oil and Gas Extraction",Oil and Gas Extraction,"Whiting Petroleum Corporation, an independent oil and gas company, engages in the acquisition, exploration, development, and production of crude oil, natural gas, and natural gas liquids primarily in the Rocky Mountains region of the United States.",2,-0.09678862246841191,0.23382335909363297
1261654.0,GV_156633,156633,UTI,USA,UNIVERSAL TECHNICAL INST,Consumer Discretionary,Consumer Services,Diversified Consumer Services,Education Services,8200,611210,Junior Colleges,Educational Services,Educational Services,"Universal Technical Institute, Inc. provides postsecondary education for students seeking careers as professional automotive, diesel, collision repair, motorcycle, and marine technicians in the United States.",2,-0.009261151869576727,0.1972461469838631
1264755.0,GV_156618,156618,NAL,USA,NEWALLIANCE BANCSHARES INC,Financials,Banks,Thrifts & Mortgage Finance,Thrifts & Mortgage Finance,6036,522120,Savings Institutions,Finance and Insurance,Credit Intermediation and Related Activities,"As of April 15, 2011, NewAlliance Bancshares, Inc. was acquired by First Niagara Financial Group Inc. NewAlliance Bancshares, Inc. operates as the bank holding company for NewAlliance Bank, which provides commercial banking, retail banking, consumer financing, trust, and investment services to individuals, families, and businesses primarily in Connecticut and western Massachusetts.",2,-0.08018358234830453,0.28218854625082157
1267238.0,GV_157057,157057,AIZ,USA,ASSURANT INC,Financials,Insurance,Insurance,Multi-line Insurance,6351,524126,Direct Property and Casualty Insurance Carriers,Finance and Insurance,Insurance Carriers and Related Activities,"Assurant, Inc., through its subsidiaries, provides risk management solutions for housing and lifestyle markets in North America, Latin America, Europe, and the Asia Pacific.",2,-0.1023776912908101,0.2907212878850662
1267395.0,GV_157353,157353,AHL,BMU,ASPEN INSURANCE HOLDINGS LTD,Financials,Insurance,Insurance,Property & Casualty Insurance,6331,524130,Reinsurance Carriers,Finance and Insurance,Insurance Carriers and Related Activities,"Aspen Insurance Holdings Limited, through its subsidiaries, engages in insurance and reinsurance businesses in Bermuda, the United States, the United Kingdom, and internationally.",2,-0.025881614823719905,0.32489239629563754
1268896.0,GV_259503,259503,LFC,CHN,CHINA LIFE INSURANCE (CHN),Financials,Insurance,Insurance,Life & Health Insurance,6311,524113,Direct Life Insurance Carriers,Finance and Insurance,Insurance Carriers and Related Activities,"China Life Insurance Company Limited, together with its subsidiaries, operates as a life insurance company in the People’s Republic of China.",2,-0.0728458814720276,0.2165591514729031
1269238.0,GV_157413,157413,TCOM,CYM,TRIP COM GROUP LTD,Consumer Discretionary,Retailing,Internet & Direct Marketing Retail,Internet & Direct Marketing Retail,4700,561510,Travel Agencies,Administrative and Support and Waste Management and Remediation Services,Administrative and Support Services,"Trip.com Group Limited operates as a travel service provider for accommodation reservation, transportation ticketing, packaged tours, and corporate travel management in China.",2,-0.09565471372348991,0.19597508745284112
